{
  "$schema": "https://raw.githubusercontent.com/juliendurandeu/jonah-fleet/main/schema.json",
  "version": "1.6.0",
  "preset": "standard",
  "dualExecution": {
    "enabled": true,
    "cloudPriorities": [
      "P0",
      "P1"
    ],
    "cloudCatchupHours": 48
  },
  "routines": {
    "autowork": true,
    "peer-review": true,
    "optimizer": true,
    "issues-housekeeping": true,
    "dependency-update-security-check": true,
    "product-planning": false,
    "analytics-review": false
  },
  "models": {
    "default": "gemini-3.7-flash-high",
    "issues-housekeeping": "gemini-3.7-flash",
    "dependency-update-security-check": "gemini-3.7-flash"
  },
  "budgets": {
    "weeklyTokens": 8750000,
    "timeoutMinutes": {
      "autowork": 60,
      "peer-review": 55,
      "optimizer": 35,
      "issues-housekeeping": 40,
      "dependency-update-security-check": 25
    },
    "maxIterations": {
      "autowork": 65,
      "peer-review": 40,
      "optimizer": 30,
      "issues-housekeeping": 30,
      "dependency-update-security-check": 20
    }
  },
  "skills": [
    "tdd",
    "code-review",
    "codebase-design",
    "domain-modeling",
    "diagnosing-bugs",
    "resolving-merge-conflicts",
    "writing-for-agents",
    "triage",
    "grill-me"
  ],
  "autoUpdate": {
    "enabled": true,
    "channel": "stable"
  }
}
